{
  "$schema": "../schema/valoare-teren.schema.json",
  "id": "valoare-teren-ms-2026",
  "title": "Valoarea terenului, județul MS, grila 2026 pe fondul funciar 2014",
  "publisher": "romania-reforms",
  "counties": [
    "MS"
  ],
  "period": "2026",
  "currency": "EUR",
  "provenance": {
    "source": "unnpr-terenuri-mures-2026",
    "locator": "grila notarială 2026 × fondul funciar INS AGR101B 2014, pe unitate administrativ-teritorială",
    "confidence": "derived",
    "note": "valoare = suprafață_curți_construcții × preț_intravilan_CC + Σ suprafață_categorie × preț_extravilan_categorie. Prețul intravilan al unei comune nu este unul singur: grila publică un preț pe sat, respectiv pe zonă, fără suprafețe cu care să fie ponderate, așa că low/central/high sunt minimul, media neponderată și maximul prețurilor publicate."
  },
  "assumptions": {
    "sourceCurrency": "RON",
    "ronPerEur": 5.2567,
    "exchangeRateDate": "2026-09-01",
    "intravilanCategory": "CC",
    "areaYear": 2014,
    "gridYear": 2026,
    "weighting": "unweighted: villages and zones have no published areas"
  },
  "summary": {
    "localities": 102,
    "localitiesInRegister": 102,
    "unmatched": [],
    "coverage": {
      "localitiesExpected": 102,
      "localitiesValued": 102,
      "share": 1.0
    },
    "coveredHa": 671388.0,
    "pricedHa": 640503.0,
    "priceableHa": 671388.0,
    "builtHa": 19921.0,
    "landValueEur": {
      "low": 5441087568,
      "central": 6692941234,
      "high": 8445169977
    },
    "taxableValueEur": {
      "low": 4133809423,
      "central": 4682126968,
      "high": 5397566155
    },
    "taxableSharePercent": 69.96,
    "highToLowRatio": 1.55
  },
  "localities": [
    {
      "siruta": "114319",
      "name": "TARGU MURES",
      "rank": "municipii",
      "pricedBy": "zone",
      "parts": 4,
      "totalHa": 4930.0,
      "builtHa": 1490.0,
      "privateHa": 2586.0,
      "privateBuiltHa": 478.0,
      "forestHa": 1198.0,
      "forestPrivateHa": 884.0,
      "forestValueEur": 6836989,
      "pricedExtravilanHa": 2449.0,
      "intravilanEurPerM2": {
        "low": 27.583845,
        "central": 92.500999,
        "high": 190.233416
      },
      "areaHa": {
        "A": 970.0,
        "P+F": 218.0,
        "V+L": 63.0,
        "AP": 145.0,
        "CC": 1490.0,
        "DR": 802.0,
        "NP": 44.0
      },
      "privateAreaHa": {
        "A": 932.0,
        "P+F": 177.0,
        "V+L": 60.0,
        "CC": 478.0,
        "DR": 24.0,
        "NP": 31.0
      },
      "extravilanEurPerM2": {
        "A": 4.831929,
        "V+L": 1.845264,
        "P+F": 1.731124,
        "PADURE": 0.5707
      },
      "extravilanValueEur": 58643065,
      "extravilanValueByCodeEur": {
        "PADURE": 6836989,
        "A": 46869709,
        "V+L": 1162516,
        "P+F": 3773851
      },
      "landValueEur": {
        "low": 469642361,
        "central": 1436907946,
        "high": 2893120969
      },
      "taxableValueEur": {
        "low": 186100595,
        "central": 496404588,
        "high": 963565545
      },
      "taxableExtravilanValueEur": 54249815,
      "taxableExtravilanValueByCodeEur": {
        "PADURE": 5044990,
        "A": 45033576,
        "V+L": 1107158,
        "P+F": 3064090
      }
    },
    {
      "siruta": "114355",
      "name": "CRISTESTI",
      "rank": "comune",
      "pricedBy": "village",
      "parts": 1,
      "totalHa": 1335.0,
      "builtHa": 242.0,
      "privateHa": 1197.0,
      "privateBuiltHa": 223.0,
      "forestHa": 130.0,
      "forestPrivateHa": 130.0,
      "forestValueEur": 692450,
      "pricedExtravilanHa": 1012.0,
      "intravilanEurPerM2": {
        "low": 26.442445,
        "central": 26.442445,
        "high": 26.442445
      },
      "areaHa": {
        "A": 750.0,
        "P+F": 130.0,
        "V+L": 2.0,
        "AP": 39.0,
        "CC": 242.0,
        "DR": 31.0,
        "NP": 11.0
      },
      "privateAreaHa": {
        "A": 749.0,
        "P+F": 49.0,
        "V+L": 2.0,
        "AP": 10.0,
        "CC": 223.0,
        "DR": 27.0,
        "NP": 7.0
      },
      "extravilanEurPerM2": {
        "A": 2.130614,
        "V+L": 0.91312,
        "P+F": 0.837027,
        "PADURE": 0.532654
      },
      "extravilanValueEur": 17778454,
      "extravilanValueByCodeEur": {
        "PADURE": 692450,
        "A": 15979607,
        "V+L": 18262,
        "P+F": 1088135
      },
      "landValueEur": {
        "low": 81769171,
        "central": 81769171,
        "high": 81769171
      },
      "taxableValueEur": {
        "low": 76045808,
        "central": 76045808,
        "high": 76045808
      },
      "taxableExtravilanValueEur": 17079156,
      "taxableExtravilanValueByCodeEur": {
        "PADURE": 692450,
        "A": 15958301,
        "V+L": 18262,
        "P+F": 410143
      }
    },
    {
      "siruta": "114382",
      "name": "SANCRAIU DE MURES",
      "rank": "comune",
      "pricedBy": "village",
      "parts": 1,
      "totalHa": 2059.0,
      "builtHa": 626.0,
      "privateHa": 1756.0,
      "privateBuiltHa": 605.0,
      "forestHa": 337.0,
      "forestPrivateHa": 155.0,
      "forestValueEur": 1795043,
      "pricedExtravilanHa": 1373.0,
      "intravilanEurPerM2": {
        "low": 28.725246,
        "central": 28.725246,
        "high": 28.725246
      },
      "areaHa": {
        "A": 686.0,
        "P+F": 350.0,
        "AP": 37.0,
        "CC": 626.0,
        "DR": 23.0
      },
      "privateAreaHa": {
        "A": 639.0,
        "P+F": 333.0,
        "AP": 7.0,
        "CC": 605.0,
        "DR": 17.0
      },
      "extravilanEurPerM2": {
        "A": 2.130614,
        "V+L": 0.91312,
        "P+F": 0.837027,
        "PADURE": 0.532654
      },
      "extravilanValueEur": 19340651,
      "extravilanValueByCodeEur": {
        "PADURE": 1795043,
        "A": 14616014,
        "P+F": 2929595
      },
      "landValueEur": {
        "low": 199160690,
        "central": 199160690,
        "high": 199160690
      },
      "taxableValueEur": {
        "low": 191015276,
        "central": 191015276,
        "high": 191015276
      },
      "taxableExtravilanValueEur": 17227538,
      "taxableExtravilanValueByCodeEur": {
        "PADURE": 825613,
        "A": 13614625,
        "P+F": 2787300
      }
    },
    {
      "siruta": "114417",
      "name": "SANGEORGIU DE MURES",
      "rank": "comune",
      "pricedBy": "village",
      "parts": 1,
      "totalHa": 2868.0,
      "builtHa": 250.0,
      "privateHa": 2058.0,
      "privateBuiltHa": 216.0,
      "forestHa": 354.0,
      "forestPrivateHa": 141.0,
      "forestValueEur": 1885594,
      "pricedExtravilanHa": 2244.0,
      "intravilanEurPerM2": {
        "low": 31.768981,
        "central": 31.768981,
        "high": 31.768981
      },
      "areaHa": {
        "A": 1321.0,
        "P+F": 553.0,
        "V+L": 16.0,
        "AP": 1.0,
        "CC": 250.0,
        "DR": 55.0,
        "NP": 318.0
      },
      "privateAreaHa": {
        "A": 1320.0,
        "P+F": 60.0,
        "V+L": 14.0,
        "CC": 216.0,
        "NP": 307.0
      },
      "extravilanEurPerM2": {
        "A": 2.130614,
        "V+L": 0.91312,
        "P+F": 0.837027,
        "PADURE": 0.532654
      },
      "extravilanValueEur": 34805867,
      "extravilanValueByCodeEur": {
        "PADURE": 1885594,
        "A": 28145414,
        "V+L": 146099,
        "P+F": 4628759
      },
      "landValueEur": {
        "low": 114228318,
        "central": 114228318,
        "high": 114228318
      },
      "taxableValueEur": {
        "low": 98126201,
        "central": 98126201,
        "high": 98126201
      },
      "taxableExtravilanValueEur": 29505203,
      "taxableExtravilanValueByCodeEur": {
        "PADURE": 751042,
        "A": 28124108,
        "V+L": 127837,
        "P+F": 502216
      }
    },
    {
      "siruta": "114453",
      "name": "SANTANA DE MURES",
      "rank": "comune",
      "pricedBy": "village",
      "parts": 1,
      "totalHa": 2598.0,
      "builtHa": 279.0,
      "privateHa": 2353.0,
      "privateBuiltHa": 273.0,
      "forestHa": 187.0,
      "forestPrivateHa": 101.0,
      "forestValueEur": 996062,
      "pricedExtravilanHa": 2236.0,
      "intravilanEurPerM2": {
        "low": 26.442445,
        "central": 26.442445,
        "high": 26.442445
      },
      "areaHa": {
        "A": 1844.0,
        "P+F": 204.0,
        "V+L": 1.0,
        "AP": 2.0,
        "CC": 279.0,
        "DR": 15.0,
        "NP": 66.0
      },
      "privateAreaHa": {
        "A": 1819.0,
        "P+F": 110.0,
        "V+L": 1.0,
        "AP": 1.0,
        "CC": 273.0,
        "NP": 48.0
      },
      "extravilanEurPerM2": {
        "A": 2.130614,
        "V+L": 0.91312,
        "P+F": 0.837027,
        "PADURE": 0.532654
      },
      "extravilanValueEur": 42001256,
      "extravilanValueByCodeEur": {
        "PADURE": 996062,
        "A": 39288527,
        "V+L": 9131,
        "P+F": 1707535
      },
      "landValueEur": {
        "low": 115775677,
        "central": 115775677,
        "high": 115775677
      },
      "taxableValueEur": {
        "low": 112411589,
        "central": 112411589,
        "high": 112411589
      },
      "taxableExtravilanValueEur": 40223714,
      "taxableExtravilanValueByCodeEur": {
        "PADURE": 537980,
        "A": 38755873,
        "V+L": 9131,
        "P+F": 920730
      }
    },
    {
      "siruta": "114514",
      "name": "SIGHISOARA",
      "rank": "municipii",
      "pricedBy": "zone",
      "parts": 3,
      "totalHa": 9602.0,
      "builtHa": 370.0,
      "privateHa": 7095.0,
      "privateBuiltHa": 242.0,
      "forestHa": 3980.0,
      "forestPrivateHa": 1824.0,
      "forestValueEur": 21199612,
      "pricedExtravilanHa": 8703.0,
      "intravilanEurPerM2": {
        "low": 21.115909,
        "central": 31.705569,
        "high": 42.231818
      },
      "areaHa": {
        "A": 1527.0,
        "P+F": 2903.0,
        "V+L": 293.0,